PlateName,Row,Col,Well,Name,PublicID,Vector,Transcript,Symbol,x_mutation_status,NCBIGeneID,OtherDescriptions,InsertLength,pert_typeDOC45.46.47.48,A,1,A01,EMPTY,EMPTY,,,,,,,,DOC45.46.47.48,A,2,A02,EMPTY,EMPTY,,,,,,,,DOC45.46.47.48,A,3,A03,ORF017110.1_TRC317.1,TRCN0000478955,pLX_TRC317,NM_005891.2,ACAT2,ACAT2_WT.o,39,"acetoacetyl Coenzyme A thiolase|acetyl-CoA acetyltransferase, cytosolic|acetyl-CoA transferase-like protein|cytosolic acetoacetyl-CoA thiolase",1191,trt_oeDOC45.46.47.48,A,4,A04,ORF006664.1_TRC317.1,TRCN0000465491,pLX_TRC317,NM_006824.2,EBNA1BP2,EBNA1BP2_WT.o,10969,EBNA1-binding protein 2|nuclear FGF3 binding protein|nucleolar protein p40|nucleolar protein p40; homolog of yeast EBNA1-binding protein|probable rRNA-processing protein EBP2,918,trt_oeDOC45.46.47.48,A,5,A05,ORFC00001.1_TRC317.1,BRDN0000559460,pLX_TRC317,BFP.1,BFP,BFP,-40,BFP,717,ctl_vectorDOC45.46.47.48,A,6,A06,ORFC00002.1_TRC317.1,BRDN0000559463,pLX_TRC317,HcRed.1,HcRed,HCRED,-41,HcRed,684,ctl_vectorDOC45.46.47.48,A,7,A07,ORF024050.1_TRC317.1,BRDN0000560620,pLX_TRC317,NM_001243014.1,ABCB9,ABCB9_WT.c,23457,ABC transporter 9 protein|ATP-binding cassette sub-family B member 9|TAP-like protein,1788,trt_oeDOC45.46.47.48,A,8,A08,ORF022755.1_TRC317.1,BRDN0000552466,pLX_TRC317,NM_003714.2:c.176A>T,STC2,STC2_p.N59I,8614,STC-related protein|stanniocalcin-2|stanniocalcin-related protein,906,trt_oeDOC45.46.47.48,A,9,A09,ORF023854.1_TRC317.1,BRDN0000560242,pLX_TRC317,NM_005676.4,RBM10,RBM10_WT.c,8241,RNA-binding protein 10|RNA-binding protein S1-1|g patch domain-containing protein 9,2790,trt_oeDOC45.46.47.48,A,10,A10,ORF023934.1_TRC317.2,BRDN0000560406,pLX_TRC317,NM_053056.2,CCND1,CCND1_WT.c,595,B-cell CLL/lymphoma 1|B-cell lymphoma 1 protein|BCL-1 oncogene|G1/S-specific cyclin-D1|PRAD1 oncogene,885,trt_oeDOC45.46.47.48,A,11,A11,ORF023013.1_TRC317.2,BRDN0000553070,pLX_TRC317,NM_152945.2:c.243G>T,RBM45,RBM45_p.R81S,129831,RB-1|RNA-binding motif protein 45|RNA-binding protein 45|developmentally regulated RNA-binding protein 1|developmentally-regulated RNA-binding protein 1|putative RNA binding protein RB-1,1422,trt_oeDOC45.46.47.48,A,12,A12,ORF023546.1_TRC317.1,BRDN0000553731,pLX_TRC317,NM_005228.3:c.2261A>T,EGFR,EGFR_p.K754I,1956,avian erythroblastic leukemia viral (v-erb-b) oncogene homolog|cell growth inhibiting protein 40|cell proliferation-inducing protein 61|erb-b2 receptor tyrosine kinase 1|proto-oncogene c-ErbB-1|receptor tyrosine-protein kinase erbB-1,3634,trt_oeDOC45.46.47.48,A,13,A13,ORF023030.1_TRC317.1,BRDN0000553011,pLX_TRC317,NM_003629.3:c.380C>T,PIK3R3,PIK3R3_p.P127L,8503,"PI3-kinase regulatory subunit gamma|PI3-kinase subunit p55-gamma|PI3K regulatory subunit gamma|phosphatidylinositol 3-kinase 55 kDa regulatory subunit gamma|phosphatidylinositol 3-kinase regulatory subunit gamma|phosphatidylinositol 3-kinase, regulatory subunit, polypeptide 3 (p55, gamma)|phosphoinositide-3-kinase, regulatory subunit, polypeptide 3 (p55, gamma)|ptdIns-3-kinase regulatory subunit p55-gamma",1383,trt_oeDOC45.46.47.48,A,14,A14,ORF023310.1_TRC317.2,BRDN0000554074,pLX_TRC317,NM_012289.3:c.475G>C,KEAP1,KEAP1_p.A159P,9817,cytosolic inhibitor of Nrf2|kelch-like family member 19|kelch-like protein 19,1872,trt_oeDOC45.46.47.48,A,15,A15,ORF012375.1_TRC317.1,TRCN0000481645,pLX_TRC317,NM_002532.4,NUP88,NUP88_WT.o,4927,88 kDa nucleoporin|karyoporin|nuclear pore complex protein 88|nuclear pore complex protein Nup88|nucleoporin 88kD|nucleoporin Nup88,2223,trt_oeDOC45.46.47.48,A,16,A16,ORF000614.1_TRC317.1,TRCN0000467298,pLX_TRC317,NM_005310.3,GRB7,GRB7_WT.o,2886,B47|GRB7 adapter protein|epidermal growth factor receptor GRB-7,1596,trt_oeDOC45.46.47.48,A,17,A17,ORF002114.1_TRC317.3,TRCN0000471659,pLX_TRC317,NM_004217.3,AURKB,AURKB_WT.o,9212,"ARK-2|STK-1|aurora 1|aurora kinase B-Sv1|aurora kinase B-Sv2|aurora- and Ipl1-like midbody-associated protein 1|aurora-1|aurora-B|aurora-related kinase 2|aurora/IPL1-related kinase 2|protein phosphatase 1, regulatory subunit 48|serine/threonine kinase 12|serine/threonine-protein kinase 12|serine/threonine-protein kinase 5|serine/threonine-protein kinase aurora-B",1032,trt_oeDOC45.46.47.48,A,18,A18,ORF002617.1_TRC317.1,TRCN0000477544,pLX_TRC317,NM_002863.4,PYGL,PYGL_WT.o,5836,"glycogen phosphorylase, liver form",2541,trt_oeDOC45.46.47.48,A,19,A19,ORF004171.1_TRC317.1,TRCN0000471986,pLX_TRC317,NM_015942.4,MTERF3,MTERF3_WT,51001,"MTERF domain containing 1|mTERF domain-containing protein 1, mitochondrial|transcription termination factor 3, mitochondrial",1251,trt_oeDOC45.46.47.48,A,20,A20,ORF003659.1_TRC317.1,TRCN0000467399,pLX_TRC317,NM_017916.2,PIH1D1,PIH1D1_WT.o,55011,PIH1 domain-containing protein 1|nucleolar protein 17 homolog,870,trt_oeDOC45.46.47.48,A,21,A21,ORF013348.1_TRC317.3,TRCN0000465854,pLX_TRC317,NM_002982.3,CCL2,CCL2_WT.o,6347,"C-C motif chemokine 2|monocyte chemoattractant protein 1|monocyte chemoattractant protein-1|monocyte chemotactic and activating factor|monocyte chemotactic protein 1|monocyte secretory protein JE|small inducible cytokine A2 (monocyte chemotactic protein 1, homologous to mouse Sig-je)|small inducible cytokine subfamily A (Cys-Cys), member 2|small-inducible cytokine A2",297,trt_oeDOC45.46.47.48,A,22,A22,ORF002162.1_TRC317.1,TRCN0000468474,pLX_TRC317,NM_019037.2,EXOSC4,EXOSC4_WT.o,54512,exosome complex component RRP41|exosome complex exonuclease RRP41|exosome component Rrp41|ribosomal RNA-processing protein 41,735,trt_oeDOC45.46.47.48,A,23,A23,ORF018402.1_TRC317.1,TRCN0000466701,pLX_TRC317,NM_014597.4,DNTTIP2,DNTTIP2_WT.o,30836,LPTS-interacting protein 2|acidic 82 kDa protein mRNA|deoxynucleotidyltransferase terminal-interacting protein 2|estrogen receptor binding protein|tdT-interacting factor 2,2268,trt_oeDOC45.46.47.48,A,24,A24,ORF011404.1_TRC317.1,TRCN0000468386,pLX_TRC317,NM_005614.3,RHEB,RHEB_WT.o,6009,GTP-binding protein Rheb|Ras homolog enriched in brain 2,552,trt_oeDOC45.46.47.48,B,1,B01,EMPTY,EMPTY,,,,,,,,DOC45.46.47.48,B,2,B02,EMPTY,EMPTY,,,,,,,,DOC45.46.47.48,B,3,B03,ORF010560.1_TRC317.1,TRCN0000478303,pLX_TRC317,NM_016292.2,TRAP1,TRAP1_WT.o,10131,"TNFR-associated protein 1|heat shock protein 75 kDa, mitochondrial|tumor necrosis factor type 1 receptor-associated protein",2112,trt_oeDOC45.46.47.48,B,4,B04,ORF014121.1_TRC317.1,TRCN0000474892,pLX_TRC317,NM_001120.4,MFSD10,MFSD10_WT.c,10227,major facilitator superfamily domain-containing protein 10|tetracycline transporter-like protein,1365,trt_oeDOC45.46.47.48,B,5,B05,ORFC00003.1_TRC317.2,BRDN0000559468,pLX_TRC317,promegaLuc.1,LUCIFERASE,LUCIFERASE,-14,,1650,ctl_vectorDOC45.46.47.48,B,6,B06,ORFC00005.1_TRC317.1,BRDN0000559466,pLX_TRC317,eGFP.1,eGFP,EGFP,-44,eGFP,717,ctl_vectorDOC45.46.47.48,B,7,B07,ORF023619.1_TRC317.4,BRDN0000560927,pLX_TRC317,NM_001904.3:c.97_98delTCinsAA,CTNNB1,CTNNB1_p.S33N,1499,catenin beta-1,2343,trt_oeDOC45.46.47.48,B,8,B08,ORF023574.1_TRC317.2,BRDN0000553951,pLX_TRC317,NM_005228.3:c.1934C>G,EGFR,EGFR_p.S645C,1956,avian erythroblastic leukemia viral (v-erb-b) oncogene homolog|cell growth inhibiting protein 40|cell proliferation-inducing protein 61|erb-b2 receptor tyrosine kinase 1|proto-oncogene c-ErbB-1|receptor tyrosine-protein kinase erbB-1,3633,trt_oeDOC45.46.47.48,B,9,B09,ORF023510.1_TRC317.1,BRDN0000553547,pLX_TRC317,NM_005228.3:c.185T>G,EGFR,EGFR_p.L62R,1956,avian erythroblastic leukemia viral (v-erb-b) oncogene homolog|cell growth inhibiting protein 40|cell proliferation-inducing protein 61|erb-b2 receptor tyrosine kinase 1|proto-oncogene c-ErbB-1|receptor tyrosine-protein kinase erbB-1,3633,trt_oeDOC45.46.47.48,B,10,B10,ORF024038.1_TRC317.4,BRDN0000561657,pLX_TRC317,NM_000314.4,PTEN,PTEN_WT.c,5728,"MMAC1 phosphatase and tensin homolog deleted on chromosome 10|mitochondrial PTENalpha|mitochondrial phosphatase and tensin protein alpha|mutated in multiple advanced cancers 1|phosphatase and tensin-like protein|phosphatidylinositol 3,4,5-trisphosphate 3-phosphatase and dual-specificity protein phosphatase PTEN|phosphatidylinositol-3,4,5-trisphosphate 3-phosphatase and dual-specificity protein phosphatase PTEN",1209,trt_oeDOC45.46.47.48,B,11,B11,ORF001542.1_TRC317.1,TRCN0000480386,pLX_TRC317,NM_014797.2,ZBTB24,ZBTB24_WT.o,9841,POZ (BTB) and AT hook containing zinc finger 2|zinc finger and BTB domain-containing protein 24|zinc finger protein 450,2091,trt_oeDOC45.46.47.48,B,12,B12,ORF023468.1_TRC317.1,BRDN0000553501,pLX_TRC317,NM_005228.3:c.3155G>T,EGFR,EGFR_p.R1052I,1956,avian erythroblastic leukemia viral (v-erb-b) oncogene homolog|cell growth inhibiting protein 40|cell proliferation-inducing protein 61|erb-b2 receptor tyrosine kinase 1|proto-oncogene c-ErbB-1|receptor tyrosine-protein kinase erbB-1,3633,trt_oeDOC45.46.47.48,B,13,B13,ORF022964.1_TRC317.2,BRDN0000552945,pLX_TRC317,NM_000455.4:c.724G>T,STK11,STK11_p.G242W,6794,liver kinase B1|polarization-related protein LKB1|renal carcinoma antigen NY-REN-19|serine/threonine-protein kinase 11|serine/threonine-protein kinase LKB1|serine/threonine-protein kinase STK11,1299,trt_oeDOC45.46.47.48,B,14,B14,ORF023605.1_TRC317.4,BRDN0000560922,pLX_TRC317,NM_005228.3,EGFR,EGFR_p.R222L,1956,avian erythroblastic leukemia viral (v-erb-b) oncogene homolog|cell growth inhibiting protein 40|cell proliferation-inducing protein 61|erb-b2 receptor tyrosine kinase 1|proto-oncogene c-ErbB-1|receptor tyrosine-protein kinase erbB-1,3632,trt_oeDOC45.46.47.48,B,15,B15,ORF012018.1_TRC317.1,TRCN0000471709,pLX_TRC317,NM_013238.2,DNAJC15,DNAJC15_WT.o,29103,"DNAJ domain-containing|DnaJ (Hsp40) homolog, subfamily D, member 1|cell growth-inhibiting gene 22 protein|dnaJ homolog subfamily C member 15|methylation-controlled J protein",450,trt_oeDOC45.46.47.48,B,16,B16,ORF000919.1_TRC317.1,TRCN0000477447,pLX_TRC317,NM_003504.4,CDC45,CDC45_WT.o,8318,CDC45 cell division cycle 45 homolog|CDC45-related protein|cell division control protein 45 homolog|cell division cycle 45 homolog|cell division cycle 45-like 2|human CDC45,1698,trt_oeDOC45.46.47.48,B,17,B17,ORF006822.1_TRC317.1,TRCN0000480103,pLX_TRC317,NM_006164.4,NFE2L2,NFE2L2_WT.o,4780,"HEBP1|NF-E2-related factor 2|NFE2-related factor 2|nuclear factor (erythroid-derived 2)-like 2|nuclear factor erythroid 2-related factor 2|nuclear factor erythroid-derived 2-like 2|nuclear factor, erythroid derived 2, like 2",1815,trt_oeDOC45.46.47.48,B,18,B18,ORF015838.1_TRC317.1,TRCN0000473574,pLX_TRC317,NM_017458.3,MVP,MVP_WT.o,9961,lung resistance-related protein,2679,trt_oeDOC45.46.47.48,B,19,B19,ORF008038.1_TRC317.1,TRCN0000475236,pLX_TRC317,NM_016065.3,MRPS16,MRPS16_WT.o,51021,"28S ribosomal protein S16, mitochondrial|S16mt",411,trt_oeDOC45.46.47.48,B,20,B20,ORF012167.1_TRC317.1,TRCN0000466014,pLX_TRC317,NM_001202.3,BMP4,BMP4_WT.o,652,BMP-2B|BMP-4|bone morphogenetic protein 2B,1224,trt_oeDOC45.46.47.48,B,21,B21,ORF018510.1_TRC317.1,TRCN0000478952,pLX_TRC317,NM_002939.3,RNH1,RNH1_WT.o,6050,placental RNase inhibitor|placental ribonuclease inhibitor|ribonuclease inhibitor,1383,trt_oeDOC45.46.47.48,B,22,B22,ORF014699.1_TRC317.1,TRCN0000476713,pLX_TRC317,NM_001359.1,DECR1,DECR1_WT.o,1666,"2,4-dienoyl-CoA reductase, mitochondrial|4-enoyl-CoA reductase|short chain dehydrogenase/reductase family 18C, member 1",1005,trt_oeDOC45.46.47.48,B,23,B23,ORF013225.1_TRC317.1,TRCN0000473305,pLX_TRC317,NM_175629.2,DNMT3A,DNMT3A_WT.o,1788,DNA (cytosine-5)-methyltransferase 3A|DNA MTase HsaIIIA|DNA cytosine methyltransferase 3A2,2736,trt_oeDOC45.46.47.48,B,24,B24,ORF000472.1_TRC317.1,TRCN0000465331,pLX_TRC317,NM_001033032.1,FAIM,FAIM_WT.o,55179,fas apoptotic inhibitory molecule 1,537,trt_oeDOC45.46.47.48,C,1,C01,ORF005766.1_TRC317.1,TRCN0000468050,pLX_TRC317,NM_001243014.1,ABCB9,ABCB9_WT.o,23457,ABC transporter 9 protein|ATP-binding cassette sub-family B member 9|TAP-like protein,1788,trt_oeDOC45.46.47.48,C,2,C02,ORF022903.1_TRC317.2,BRDN0000552799,pLX_TRC317,NM_000455.4:c.733C>T,STK11,STK11_p.L245F,6794,liver kinase B1|polarization-related protein LKB1|renal carcinoma antigen NY-REN-19|serine/threonine-protein kinase 11|serine/threonine-protein kinase LKB1|serine/threonine-protein kinase STK11,1299,trt_oeDOC45.46.47.48,C,3,C03,ORFC00005.1_TRC317.1,BRDN0000559466,pLX_TRC317,eGFP.1,eGFP,EGFP,-44,eGFP,717,ctl_vectorDOC45.46.47.48,C,4,C04,ORFC00002.1_TRC317.1,BRDN0000559463,pLX_TRC317,HcRed.1,HcRed,HCRED,-41,HcRed,684,ctl_vectorDOC45.46.47.48,C,5,C05,ORF024071.1_TRC317.2,BRDN0000560706,pLX_TRC317,NM_001654.4:c.641C>T;1286A>C,ARAF,"ARAF_p.S214F, p.D429A",369,A-Raf proto-oncogene serine/threonine-protein kinase|Oncogene ARAF1|Ras-binding protein DA-Raf|proto-oncogene A-Raf-1|proto-oncogene Pks|serine/threonine-protein kinase A-Raf|v-raf murine sarcoma 3611 viral oncogene homolog 1,1818,trt_oeDOC45.46.47.48,C,6,C06,ORF022818.1_TRC317.1,BRDN0000552529,pLX_TRC317,NM_032782.4:c.343C>G,HAVCR2,HAVCR2_p.P115A,84868,T cell immunoglobulin mucin 3|T cell immunoglobulin mucin-3|T-cell immunoglobulin and mucin domain-containing protein 3|T-cell immunoglobulin mucin family member 3|T-cell immunoglobulin mucin receptor 3|T-cell membrane protein 3|kidney injury molecule-3,903,trt_oeDOC45.46.47.48,C,7,C07,ORF023518.1_TRC317.3,BRDN0000560789,pLX_TRC317,NM_001904.3:c.101G>T,CTNNB1,CTNNB1_p.G34V,1499,catenin beta-1,2343,trt_oeDOC45.46.47.48,C,8,C08,ORF023166.1_TRC317.2,BRDN0000553313,pLX_TRC317,NM_014797.2:c.368A>T,ZBTB24,ZBTB24_p.K123M,9841,POZ (BTB) and AT hook containing zinc finger 2|zinc finger and BTB domain-containing protein 24|zinc finger protein 450,2091,trt_oeDOC45.46.47.48,C,9,C09,ORF023615.1_TRC317.1,BRDN0000554139,pLX_TRC317,NM_001098209.1,CTNNB1,CTNNB1_p.V600G,1499,catenin beta-1,2343,trt_oeDOC45.46.47.48,C,10,C10,ORF023465.1_TRC317.2,BRDN0000553586,pLX_TRC317,NM_001654.4:c.287T>A,ARAF,ARAF_p.L96Q,369,A-Raf proto-oncogene serine/threonine-protein kinase|Oncogene ARAF1|Ras-binding protein DA-Raf|proto-oncogene A-Raf-1|proto-oncogene Pks|serine/threonine-protein kinase A-Raf|v-raf murine sarcoma 3611 viral oncogene homolog 1,1818,trt_oeDOC45.46.47.48,C,11,C11,ORF023340.1_TRC317.2,BRDN0000554111,pLX_TRC317,NM_012289.3:c.422A>T,KEAP1,KEAP1_p.Y141F,9817,cytosolic inhibitor of Nrf2|kelch-like family member 19|kelch-like protein 19,1872,trt_oeDOC45.46.47.48,C,12,C12,ORF023489.1_TRC317.1,BRDN0000553524,pLX_TRC317,NM_201282.1,EGFR,EGFR_p.R377S,1956,avian erythroblastic leukemia viral (v-erb-b) oncogene homolog|cell growth inhibiting protein 40|cell proliferation-inducing protein 61|erb-b2 receptor tyrosine kinase 1|proto-oncogene c-ErbB-1|receptor tyrosine-protein kinase erbB-1,2053,trt_oeDOC45.46.47.48,C,13,C13,ORF022676.1_TRC317.1,BRDN0000552296,pLX_TRC317,NM_002382.3:c.104G>T,MAX,MAX_p.R35L,4149,class D basic helix-loop-helix protein 4|protein max,480,trt_oeDOC45.46.47.48,C,14,C14,ORF023103.1_TRC317.1,BRDN0000553160,pLX_TRC317,NM_012289.3:c.464T>C,KEAP1,KEAP1_p.V155A,9817,cytosolic inhibitor of Nrf2|kelch-like family member 19|kelch-like protein 19,1872,trt_oeDOC45.46.47.48,C,15,C15,ORF022957.1_TRC317.1,BRDN0000552853,pLX_TRC317,NM_003629.3:c.1222A>C,PIK3R3,PIK3R3_p.S408R,8503,"PI3-kinase regulatory subunit gamma|PI3-kinase subunit p55-gamma|PI3K regulatory subunit gamma|phosphatidylinositol 3-kinase 55 kDa regulatory subunit gamma|phosphatidylinositol 3-kinase regulatory subunit gamma|phosphatidylinositol 3-kinase, regulatory subunit, polypeptide 3 (p55, gamma)|phosphoinositide-3-kinase, regulatory subunit, polypeptide 3 (p55, gamma)|ptdIns-3-kinase regulatory subunit p55-gamma",1383,trt_oeDOC45.46.47.48,C,16,C16,ORF023372.1_TRC317.1,BRDN0000554221,pLX_TRC317,NM_001145301.2,RARA,RARA_p.D256Y,5914,"RAR-alpha|nuclear receptor subfamily 1 group B member 1|nucleophosmin-retinoic acid receptor alpha fusion protein NPM-RAR long form|retinoic acid nuclear receptor alpha variant 1|retinoic acid nuclear receptor alpha variant 2|retinoic acid receptor alpha|retinoic acid receptor, alpha polypeptide",1306,trt_oeDOC45.46.47.48,C,17,C17,EMPTY,EMPTY,,,,,,,,DOC45.46.47.48,C,18,C18,ORF023441.1_TRC317.4,BRDN0000560867,pLX_TRC317,NM_022445.3:c.553C>A,TPK1,TPK1_p.L185I,27010,placental protein 20|thiamine diphosphokinase|thiamine kinase,731,trt_oeDOC45.46.47.48,C,19,C19,ORF023345.1_TRC317.2,BRDN0000554117,pLX_TRC317,NM_012289.3:c.779G>T,KEAP1,KEAP1_p.R260L,9817,cytosolic inhibitor of Nrf2|kelch-like family member 19|kelch-like protein 19,813,trt_oeDOC45.46.47.48,C,20,C20,ORF024026.1_TRC317.2,BRDN0000560593,pLX_TRC317,NM_000570.4,FCGR3B,FCGR3B_WT.c,2215,Fc-gamma receptor IIIb (CD 16)|fc-gamma RIII-beta|fc-gamma RIIIb|igG Fc receptor III-1|low affinity immunoglobulin gamma Fc region receptor III-B,699,trt_oeDOC45.46.47.48,C,21,C21,ORF023040.1_TRC317.1,BRDN0000553021,pLX_TRC317,NM_005163.2:c.49G>A,AKT1,AKT1_p.E17K,207,AKT1m|PKB alpha|RAC-PK-alpha|RAC-alpha serine/threonine-protein kinase|protein kinase B alpha|proto-oncogene c-Akt|rac protein kinase alpha,1440,trt_oeDOC45.46.47.48,C,22,C22,ORF023312.1_TRC317.2,BRDN0000554077,pLX_TRC317,NM_014797.2:c.2077G>A,ZBTB24,ZBTB24_p.G693S,9841,POZ (BTB) and AT hook containing zinc finger 2|zinc finger and BTB domain-containing protein 24|zinc finger protein 450,2091,trt_oeDOC45.46.47.48,C,23,C23,ORF022712.1_TRC317.2,BRDN0000552422,pLX_TRC317,NM_002639.4:c.493G>A,SERPINB5,SERPINB5_p.A165T,5268,"PI-5|peptidase inhibitor 5|protease inhibitor 5 (maspin)|serine (or cysteine) proteinase inhibitor, clade B (ovalbumin), member 5|serpin B5",693,trt_oeDOC45.46.47.48,C,24,C24,EMPTY,EMPTY,,,,,,,,DOC45.46.47.48,D,1,D01,ORF023206.1_TRC317.1,BRDN0000553671,pLX_TRC317,NM_012289.3:c.815G>C,KEAP1,KEAP1_p.R272P,9817,cytosolic inhibitor of Nrf2|kelch-like family member 19|kelch-like protein 19,1873,trt_oeDOC45.46.47.48,D,2,D02,ORF003731.1_TRC317.1,TRCN0000480196,pLX_TRC317,NM_002639.4,SERPINB5,SERPINB5_WT.o,5268,"PI-5|peptidase inhibitor 5|protease inhibitor 5 (maspin)|serine (or cysteine) proteinase inhibitor, clade B (ovalbumin), member 5|serpin B5",693,trt_oeDOC45.46.47.48,D,3,D03,ORFC00001.1_TRC317.1,BRDN0000559460,pLX_TRC317,BFP.1,BFP,BFP,-40,BFP,717,ctl_vectorDOC45.46.47.48,D,4,D04,ORFC00002.1_TRC317.1,BRDN0000559463,pLX_TRC317,HcRed.1,HcRed,HCRED,-41,HcRed,684,ctl_vectorDOC45.46.47.48,D,5,D05,ORF022757.1_TRC317.2,BRDN0000552561,pLX_TRC317,NM_199133.2:c.560G>C,FAM173B,FAM173B_p.R187P,134145,protein FAM173B,699,trt_oeDOC45.46.47.48,D,6,D06,ORF023099.1_TRC317.2,BRDN0000553246,pLX_TRC317,NM_015726.3:c.1676G>C,DCAF8,DCAF8_p.R559P,50717,DDB1- and CUL4-associated factor 8|WD repeat domain 42A|WD repeat-containing protein 42A,1896,trt_oeDOC45.46.47.48,D,7,D07,ORF022807.1_TRC317.1,BRDN0000552518,pLX_TRC317,NM_032782.4:c.381G>T,HAVCR2,HAVCR2_p.L127F,84868,T cell immunoglobulin mucin 3|T cell immunoglobulin mucin-3|T-cell immunoglobulin and mucin domain-containing protein 3|T-cell immunoglobulin mucin family member 3|T-cell immunoglobulin mucin receptor 3|T-cell membrane protein 3|kidney injury molecule-3,903,trt_oeDOC45.46.47.48,D,8,D08,ORF023143.1_TRC317.2,BRDN0000553290,pLX_TRC317,NM_014797.2:c.2006A>G,ZBTB24,ZBTB24_p.Q669R,9841,POZ (BTB) and AT hook containing zinc finger 2|zinc finger and BTB domain-containing protein 24|zinc finger protein 450,2092,trt_oeDOC45.46.47.48,D,9,D09,ORF023331.1_TRC317.2,BRDN0000554100,pLX_TRC317,NM_152945.2:c.646G>A,RBM45,RBM45_p.E216K,129831,RB-1|RNA-binding motif protein 45|RNA-binding protein 45|developmentally regulated RNA-binding protein 1|developmentally-regulated RNA-binding protein 1|putative RNA binding protein RB-1,1423,trt_oeDOC45.46.47.48,D,10,D10,ORF023160.1_TRC317.1,BRDN0000553217,pLX_TRC317,NM_006186.3:c.1361G>T,NR4A2,NR4A2_p.R454M,4929,"NGFI-B/nur77 beta-type transcription factor homolog|T-cell nuclear receptor NOT|immediate-early response protein NOT|intermediate-early receptor protein|nuclear receptor related 1|nuclear receptor subfamily 4 group A member 2|nur related protein-1, human homolog of|orphan nuclear receptor NR4A2|orphan nuclear receptor NURR1|transcriptionally inducible nuclear receptor related 1|transcriptionally-inducible nuclear receptor",1794,trt_oeDOC45.46.47.48,D,11,D11,ORF023258.1_TRC317.1,BRDN0000553729,pLX_TRC317,NM_006186.3:c.691G>T,NR4A2,NR4A2_p.G231C,4929,"NGFI-B/nur77 beta-type transcription factor homolog|T-cell nuclear receptor NOT|immediate-early response protein NOT|intermediate-early receptor protein|nuclear receptor related 1|nuclear receptor subfamily 4 group A member 2|nur related protein-1, human homolog of|orphan nuclear receptor NR4A2|orphan nuclear receptor NURR1|transcriptionally inducible nuclear receptor related 1|transcriptionally-inducible nuclear receptor",1794,trt_oeDOC45.46.47.48,D,12,D12,ORF023080.1_TRC317.1,BRDN0000553137,pLX_TRC317,NM_012289.3:c.305C>T,KEAP1,KEAP1_p.S102L,9817,cytosolic inhibitor of Nrf2|kelch-like family member 19|kelch-like protein 19,1872,trt_oeDOC45.46.47.48,D,13,D13,ORF023112.1_TRC317.2,BRDN0000553259,pLX_TRC317,NM_012289.3:c.431C>T,KEAP1,KEAP1_p.S144F,9817,cytosolic inhibitor of Nrf2|kelch-like family member 19|kelch-like protein 19,1872,trt_oeDOC45.46.47.48,D,14,D14,ORF014923.1_TRC317.1,BRDN0000554267,pLX_TRC317,NM_012289.3,KEAP1,KEAP1_WT.o,9817,cytosolic inhibitor of Nrf2|kelch-like family member 19|kelch-like protein 19,1872,trt_oeDOC45.46.47.48,D,15,D15,ORF022986.1_TRC317.1,BRDN0000552882,pLX_TRC317,NM_000455.4:c.579_580delCGinsAT,STK11,STK11_p.D194Y.unin.fs,6794,liver kinase B1|polarization-related protein LKB1|renal carcinoma antigen NY-REN-19|serine/threonine-protein kinase 11|serine/threonine-protein kinase LKB1|serine/threonine-protein kinase STK11,1292,trt_oeDOC45.46.47.48,D,16,D16,ORF023271.1_TRC317.1,BRDN0000553745,pLX_TRC317,NM_012289.3:c.958_959delCGinsAT,KEAP1,KEAP1_p.R320M,9817,cytosolic inhibitor of Nrf2|kelch-like family member 19|kelch-like protein 19,1872,trt_oeDOC45.46.47.48,D,17,D17,ORF023083.1_TRC317.1,BRDN0000553140,pLX_TRC317,NM_012289.3:c.1570G>T,KEAP1,KEAP1_p.G524C,9817,cytosolic inhibitor of Nrf2|kelch-like family member 19|kelch-like protein 19,1872,trt_oeDOC45.46.47.48,D,18,D18,ORF023264.1_TRC317.1,BRDN0000553737,pLX_TRC317,NM_006186.3:c.1042A>C,NR4A2,NR4A2_p.K348Q,4929,"NGFI-B/nur77 beta-type transcription factor homolog|T-cell nuclear receptor NOT|immediate-early response protein NOT|intermediate-early receptor protein|nuclear receptor related 1|nuclear receptor subfamily 4 group A member 2|nur related protein-1, human homolog of|orphan nuclear receptor NR4A2|orphan nuclear receptor NURR1|transcriptionally inducible nuclear receptor related 1|transcriptionally-inducible nuclear receptor",1794,trt_oeDOC45.46.47.48,D,19,D19,EMPTY,EMPTY,,,,,,,,DOC45.46.47.48,D,20,D20,EMPTY,EMPTY,,,,,,,,DOC45.46.47.48,D,21,D21,ORF001052.1_TRC317.1,TRCN0000479571,pLX_TRC317,NM_015014.2,RBM34,RBM34_WT.o,23029,RNA-binding motif protein 34|RNA-binding protein 34,1275,trt_oeDOC45.46.47.48,D,22,D22,ORF022768.1_TRC317.1,BRDN0000552479,pLX_TRC317,NM_199133.2:c.302G>T,FAM173B,FAM173B_p.R101L,134145,protein FAM173B,699,trt_oeDOC45.46.47.48,D,23,D23,ORF022686.1_TRC317.2,BRDN0000552397,pLX_TRC317,NM_002639.4:c.425G>T,SERPINB5,SERPINB5_p.G142V,5268,"PI-5|peptidase inhibitor 5|protease inhibitor 5 (maspin)|serine (or cysteine) proteinase inhibitor, clade B (ovalbumin), member 5|serpin B5",693,trt_oeDOC45.46.47.48,D,24,D24,ORF023599.1_TRC317.1,BRDN0000553914,pLX_TRC317,NM_005228.3:c.2369C>T,EGFR,EGFR_p.T790M,1956,avian erythroblastic leukemia viral (v-erb-b) oncogene homolog|cell growth inhibiting protein 40|cell proliferation-inducing protein 61|erb-b2 receptor tyrosine kinase 1|proto-oncogene c-ErbB-1|receptor tyrosine-protein kinase erbB-1,3497,trt_oeDOC45.46.47.48,E,1,E01,ORF023295.1_TRC317.3,BRDN0000560904,pLX_TRC317,NM_005676.4:c.1247A>T,RBM10,RBM10_p.Q416L,8241,RNA-binding protein 10|RNA-binding protein S1-1|g patch domain-containing protein 9,2789,trt_oeDOC45.46.47.48,E,2,E02,ORF023562.1_TRC317.2,BRDN0000553938,pLX_TRC317,NM_005228.3:c.2702G>T,EGFR,EGFR_p.G901V,1956,avian erythroblastic leukemia viral (v-erb-b) oncogene homolog|cell growth inhibiting protein 40|cell proliferation-inducing protein 61|erb-b2 receptor tyrosine kinase 1|proto-oncogene c-ErbB-1|receptor tyrosine-protein kinase erbB-1,3654,trt_oeDOC45.46.47.48,E,3,E03,ORF023136.1_TRC317.2,BRDN0000553283,pLX_TRC317,NM_012289.3:c.1490G>T,KEAP1,KEAP1_p.W497L,9817,cytosolic inhibitor of Nrf2|kelch-like family member 19|kelch-like protein 19,1872,trt_oeDOC45.46.47.48,E,4,E04,ORF023093.1_TRC317.2,BRDN0000553240,pLX_TRC317,NM_012289.3:c.295G>T,KEAP1,KEAP1_p.V99L,9817,cytosolic inhibitor of Nrf2|kelch-like family member 19|kelch-like protein 19,1873,trt_oeDOC45.46.47.48,E,5,E05,ORFC00002.1_TRC317.1,BRDN0000559463,pLX_TRC317,HcRed.1,HcRed,HCRED,-41,HcRed,684,ctl_vectorDOC45.46.47.48,E,6,E06,ORFC00005.1_TRC317.1,BRDN0000559466,pLX_TRC317,eGFP.1,eGFP,EGFP,-44,eGFP,717,ctl_vectorDOC45.46.47.48,E,7,E07,ORF022943.1_TRC317.2,BRDN0000552924,pLX_TRC317,NM_000455.4:c.167G>T,STK11,STK11_p.G56V,6794,liver kinase B1|polarization-related protein LKB1|renal carcinoma antigen NY-REN-19|serine/threonine-protein kinase 11|serine/threonine-protein kinase LKB1|serine/threonine-protein kinase STK11,1299,trt_oeDOC45.46.47.48,E,8,E08,ORF022697.1_TRC317.1,BRDN0000552317,pLX_TRC317,NM_002639.4:c.476T>G,SERPINB5,SERPINB5_p.I159S,5268,"PI-5|peptidase inhibitor 5|protease inhibitor 5 (maspin)|serine (or cysteine) proteinase inhibitor, clade B (ovalbumin), member 5|serpin B5",693,trt_oeDOC45.46.47.48,E,9,E09,ORF023963.1_TRC317.2,BRDN0000560529,pLX_TRC317,NM_032782.4,HAVCR2,HAVCR2_WT.c,84868,T cell immunoglobulin mucin 3|T cell immunoglobulin mucin-3|T-cell immunoglobulin and mucin domain-containing protein 3|T-cell immunoglobulin mucin family member 3|T-cell immunoglobulin mucin receptor 3|T-cell membrane protein 3|kidney injury molecule-3,903,trt_oeDOC45.46.47.48,E,10,E10,ORF022745.1_TRC317.2,BRDN0000552549,pLX_TRC317,NM_000570.4:c.653T>C,FCGR3B,FCGR3B_p.L218P,2215,Fc-gamma receptor IIIb (CD 16)|fc-gamma RIII-beta|fc-gamma RIIIb|igG Fc receptor III-1|low affinity immunoglobulin gamma Fc region receptor III-B,699,trt_oe